{
  "reportType": "winre-plan",
  "schemaVersion": 1,
  "windowsVolume": {
    "logicalName": "Windows",
    "letter": "W",
    "source": "fixture"
  },
  "efiVolume": {
    "logicalName": "EFI",
    "letter": "S",
    "source": "fixture"
  },
  "recoveryVolume": {
    "logicalName": "Recovery",
    "letter": "R",
    "gptType": "de94bba4-06d1-4d40-a16a-bfd50179d6ac",
    "gptAttributes": "0x8000000000000001",
    "source": "fixture"
  },
  "winreWim": "R:\\Recovery\\WindowsRE\\winre.wim",
  "plannedCommands": [
    "reagentc /setreimage /path R:\\Recovery\\WindowsRE /target W:\\Windows",
    "reagentc /enable /osguid <placeholder>",
    "reagentc /info /target W:\\Windows"
  ],
  "status": "planned"
}
